{
  "schema": "music-studies/performance-rig/v1",
  "kind": "switch-triggers",
  "id": "performance-switch-triggers",
  "rig": "pedro-performance-rig",
  "layer": "management",
  "triggers": [
    {"id":"arturia-pad-a-1-organ","source_slot":"arturia-main","hardware_preset":"arturia-pad-switches","event":{"type":"note","channel":10,"number":40,"edge":"press"},"operation":{"type":"activate-rig-profile","rig_profile":"tonewheel-organ-setbfree"},"consume":true,"debounce_ms":300,"maximum_readiness":"control-only","enabled":true},
    {"id":"arturia-pad-a-2-synth","source_slot":"arturia-main","hardware_preset":"arturia-pad-switches","event":{"type":"note","channel":10,"number":41,"edge":"press"},"operation":{"type":"activate-rig-profile","rig_profile":"synth-programmer-synthv1"},"consume":true,"debounce_ms":300,"maximum_readiness":"control-only","enabled":true},
    {"id":"arturia-pad-a-3-live","source_slot":"arturia-main","hardware_preset":"arturia-pad-switches","event":{"type":"note","channel":10,"number":42,"edge":"press"},"operation":{"type":"activate-rig-profile","rig_profile":"full-live-rack"},"consume":true,"debounce_ms":300,"maximum_readiness":"control-only","enabled":true},
    {"id":"arturia-pad-a-4-worship-piano","source_slot":"arturia-main","hardware_preset":"arturia-pad-switches","event":{"type":"note","channel":10,"number":43,"edge":"press"},"operation":{"type":"activate-rig-profile","rig_profile":"worship-piano"},"consume":true,"debounce_ms":300,"maximum_readiness":"control-only","enabled":true},
    {"id":"arturia-pad-a-5-gospel-keys","source_slot":"arturia-main","hardware_preset":"arturia-pad-switches","event":{"type":"note","channel":10,"number":36,"edge":"press"},"operation":{"type":"activate-rig-profile","rig_profile":"gospel-keys"},"consume":true,"debounce_ms":300,"maximum_readiness":"control-only","enabled":true},
    {"id":"arturia-pad-a-6-ambient-worship","source_slot":"arturia-main","hardware_preset":"arturia-pad-switches","event":{"type":"note","channel":10,"number":37,"edge":"press"},"operation":{"type":"activate-rig-profile","rig_profile":"ambient-worship"},"consume":true,"debounce_ms":300,"maximum_readiness":"control-only","enabled":true},
    {"id":"arturia-pad-a-7-jazz-keys","source_slot":"arturia-main","hardware_preset":"arturia-pad-switches","event":{"type":"note","channel":10,"number":38,"edge":"press"},"operation":{"type":"activate-rig-profile","rig_profile":"jazz-keys"},"consume":true,"debounce_ms":300,"maximum_readiness":"control-only","enabled":true},
    {"id":"arturia-pad-a-8-soul-rnb","source_slot":"arturia-main","hardware_preset":"arturia-pad-switches","event":{"type":"note","channel":10,"number":39,"edge":"press"},"operation":{"type":"activate-rig-profile","rig_profile":"soul-rnb"},"consume":true,"debounce_ms":300,"maximum_readiness":"control-only","enabled":true},
    {"id":"arturia-pad-b-1-cinematic-strings","source_slot":"arturia-main","hardware_preset":"arturia-pad-switches","event":{"type":"note","channel":10,"number":48,"edge":"press"},"operation":{"type":"activate-rig-profile","rig_profile":"cinematic-strings"},"consume":true,"debounce_ms":300,"maximum_readiness":"control-only","enabled":true},
    {"id":"arturia-pad-b-2-orchestral","source_slot":"arturia-main","hardware_preset":"arturia-pad-switches","event":{"type":"note","channel":10,"number":49,"edge":"press"},"operation":{"type":"activate-rig-profile","rig_profile":"orchestral"},"consume":true,"debounce_ms":300,"maximum_readiness":"control-only","enabled":true},
    {"id":"arturia-pad-b-3-brass-winds","source_slot":"arturia-main","hardware_preset":"arturia-pad-switches","event":{"type":"note","channel":10,"number":50,"edge":"press"},"operation":{"type":"activate-rig-profile","rig_profile":"brass-winds"},"consume":true,"debounce_ms":300,"maximum_readiness":"control-only","enabled":true},
    {"id":"arturia-pad-b-4-synthwave","source_slot":"arturia-main","hardware_preset":"arturia-pad-switches","event":{"type":"note","channel":10,"number":51,"edge":"press"},"operation":{"type":"activate-rig-profile","rig_profile":"synthwave"},"consume":true,"debounce_ms":300,"maximum_readiness":"control-only","enabled":true},
    {"id":"arturia-pad-b-5-retro-keys","source_slot":"arturia-main","hardware_preset":"arturia-pad-switches","event":{"type":"note","channel":10,"number":44,"edge":"press"},"operation":{"type":"activate-rig-profile","rig_profile":"retro-keys"},"consume":true,"debounce_ms":300,"maximum_readiness":"control-only","enabled":true},
    {"id":"arturia-pad-b-6-intimate-pads","source_slot":"arturia-main","hardware_preset":"arturia-pad-switches","event":{"type":"note","channel":10,"number":45,"edge":"press"},"operation":{"type":"activate-rig-profile","rig_profile":"intimate-pads"},"consume":true,"debounce_ms":300,"maximum_readiness":"control-only","enabled":true},
    {"id":"arturia-pad-b-7-praise-leads","source_slot":"arturia-main","hardware_preset":"arturia-pad-switches","event":{"type":"note","channel":10,"number":46,"edge":"press"},"operation":{"type":"activate-rig-profile","rig_profile":"praise-leads"},"consume":true,"debounce_ms":300,"maximum_readiness":"control-only","enabled":true},
    {"id":"arturia-pad-b-8-acoustic-worship","source_slot":"arturia-main","hardware_preset":"arturia-pad-switches","event":{"type":"note","channel":10,"number":47,"edge":"press"},"operation":{"type":"activate-rig-profile","rig_profile":"acoustic-worship"},"consume":true,"debounce_ms":300,"maximum_readiness":"control-only","enabled":true}
  ]
}
